Title	URL	Assignees	Status	Estimated size	Real size	Sprint	Priority
Set Up a Pipeline with GitHub Actions	https://github.com/amosproj/amos2025ss02-building-documentation-management-system/issues/5		Product Backlog				
Scaffold Basic Angular Application	https://github.com/amosproj/amos2025ss02-building-documentation-management-system/issues/6		Product Backlog				
Research typical (German) building documents	https://github.com/amosproj/amos2025ss02-building-documentation-management-system/issues/7		Product Backlog				
Scaffold Basic C# ASP.NET Web API	https://github.com/amosproj/amos2025ss02-building-documentation-management-system/issues/9		Product Backlog				
Research Local RAG‑Based LLM Solutions	https://github.com/amosproj/amos2025ss02-building-documentation-management-system/issues/10		Product Backlog				
Linting And Formatting For Frontend	https://github.com/amosproj/amos2025ss02-building-documentation-management-system/issues/8		Product Backlog				
Linting And Formatting For Backend	https://github.com/amosproj/amos2025ss02-building-documentation-management-system/issues/11		Product Backlog				
Create a team shirt design	https://github.com/amosproj/amos2025ss02-building-documentation-management-system/issues/3		Sprint Backlog	1		Sprint 1	
Create a team logo	https://github.com/amosproj/amos2025ss02-building-documentation-management-system/issues/1	carl-egge	In Progress	1		Sprint 1	
Align on Development Guidelines (Code Style, Merge Flow, etc.)	https://github.com/amosproj/amos2025ss02-building-documentation-management-system/issues/4	arpita739, bastydjamen, kamsur, masum-abid, Nirmin96, so77nava, SyedAffan10	In Progress	1		Sprint 1	
Have a meeting with the industry partner	https://github.com/amosproj/amos2025ss02-building-documentation-management-system/issues/2	carl-egge, daku-de	Awaiting Review	1		Sprint 1	